{
  "id": 1,
  "study_id": "FARHP-DEPLOY-TEST",
  "revision": 1,
  "status": "draft",
  "fingerprint": null,
  "created_at": "2026-07-31T07:04:27.929579",
  "locked_at": null,
  "payload": {
    "created_at": "2026-07-31T06:41:53.709Z",
    "design": {
      "altered_condition": "zero",
      "blinding": "formal-trial A/B mapping and correctness hidden until completion",
      "break_every_main_trials": 1,
      "intervention_strength": 0.75,
      "ordering": "participant_indexed_latin_or_cyclic_order_plus_balanced_ABX_cells",
      "practice_trials": 1,
      "repeats_per_stimulus": 1,
      "seed": 424242,
      "selected_stimuli": [
        "nihao",
        "nihaoma"
      ]
    },
    "exclusion_policy": {
      "accuracy_based_exclusion": false,
      "max_rt_ms": 30000,
      "min_completion_ratio": 1,
      "min_plays_each_label": 1,
      "min_rt_ms": 150,
      "min_valid_trial_ratio": 0.8
    },
    "farhp_weblab_plan_version": "0.8",
    "governance": {
      "audit_policy": {
        "live_chain": "FNV32x8-live",
        "sealed_chain": "SHA-256-when-available"
      },
      "consent_template": {
        "affirmative_consent_required": true,
        "eligibility_attestation_required": true,
        "summary": "Anonymous browser regression study.",
        "title": "Test consent",
        "version": "FARHP-CONSENT-TEST-v0.8"
      },
      "deidentification_policy": "study-specific one-way pseudonym for analysis export",
      "direct_identifiers_forbidden": true,
      "local_processing_only": true,
      "research_role": "principal_investigator"
    },
    "locked_at": null,
    "plan_fingerprint": null,
    "planned_sample_size": 12,
    "preregistration_note": "Primary endpoint fixed before collection.",
    "primary_endpoint": "abx_accuracy_vs_0_5",
    "status": "draft",
    "study_id": "FARHP-DEPLOY-TEST",
    "task": "multi_stimulus_ABX_identity_match"
  },
  "previous_plan_id": null
}